"Story","Title","Result","Date","Stability","Duration (s)"
"Manage employees information","Create a new Employee information","SUCCESS","2019-11-04T05:26:51.973+01:00[Europe/Paris]","0.0","5.72"
"Manage employees information","Get employee Information","SUCCESS","2019-11-04T05:26:57.698+01:00[Europe/Paris]","0.0","1.19"
"Manage employees information","Delete Employee Information","SUCCESS","2019-11-04T05:26:58.889+01:00[Europe/Paris]","0.0","4.18"
"Calculate Tips for Amounts","Calculate Tips using default Percentage","SUCCESS","2019-11-04T05:27:07.704+01:00[Europe/Paris]","0.0","40.04"
"Calculate Tips for Amounts","Calculate Tips using a defined Percentage","SUCCESS","2019-11-04T05:27:47.744+01:00[Europe/Paris]","0.0","82.9"
